{
  "citation": "Najd Research. Najd Arena acceptance suite, version 1.0.0.",
  "license": "CC0-1.0",
  "provenance": {
    "creators": [
      "Najd Research"
    ],
    "source": "Newly authored acceptance examples in the Najd Arena repository."
  },
  "public": true,
  "restrictions": "For testing the evaluation engine; not a substantive model benchmark.",
  "review": {
    "license_approved": true,
    "privacy_approved": true,
    "raw_outputs_approved": false,
    "reviewed_at": "2026-09-14",
    "reviewer": "ma7dev"
  },
  "schema_version": "1",
  "target_id": "najd-arena-acceptance@1.0.0",
  "target_type": "suite"
}
